<?xml version="1.0" encoding="UTF-8"?>

<catalog xmlns:xsi="http://www.w3.org/2001/XMLSchema-instance" xsi:noNamespaceSchemaLocation="catalogSchema.xsd">
    
    <tablet>
        <name>iPad mini 44</name>
        <attributes>
            <price>399</price>
            <summary>p</summary>
            <operatingSystem>iOS</operatingSystem>
            <processorSpeedGHz>1.5</processorSpeedGHz>
            <capacityGB>32</capacityGB>
            <displayInch>7.9</displayInch>
            <heightMM>203.2</heightMM>
            <widthMM>134.8</widthMM>
            <depthMM>6.1</depthMM>
            <weightGrams>298.8</weightGrams>
            <cameraMP>8</cameraMP>
            <batteryHours>10</batteryHours>
            <simCard>Nano-SIM</simCard>
            <fabricator>Apple</fabricator>
            <imageURL>URL</imageURL>
        </attributes>
    </tablet>

</catalog>
